id,charity_name,logo,rating,financial_transparency,results_reporting,cents_to_cause,city,province,website,Tel,main_category,sub_category,new_overview,new_results_and_impact
65,Distress Centres of Greater Toronto,https://www.charityintelligence.ca/media/charity_logos/DCGTlogo.jpg,4,2,B+,87%,Toronto,ON,www.dcogt.com,,Social Services,,"Distress Centres of Greater Toronto is a 4-star charity with average demonstrated impact. It has an above average results reporting grade and it is financially transparent. Founded in 1967, Distress Centres of Greater Toronto (DCGT) operates several 24-hour hotlines for crisis intervention, emotional support, and suicide prevention. These supports are also available through online chat and text. DCGT’s programming is largely delivered by trained volunteers who are supervised by professional staff. DCGT merged with Brampton-based Spectra Community Support Services in May 2019, which allowed DCGT's services to expand to include multilingual language lines, enhanced support for isolated seniors, and a transitional support program for those aged 16+. The charity reports that approximately 4,000 people take their own life by suicide in Canada each year, and for every suicide loss, there are an estimated 20-25 attempts made. The charity has multiple helplines tailored to clients in varying levels and categories of distress. DCGT also runs outreach programs that call isolated seniors and at-risk individuals to check-in. No breakdown of spending by program was provided by the charity. In F2022, DCGT provided over 160,000 helping interactions, down from 186,000 in F2021. 408-Help Line is Distress Centres of Greater Toronto's biggest helpline, receiving 35,630 calls in F2022. This program covers a broad range of support services, including mental health support, crisis intervention, family violence response, and suicide prevention. In F2022, 55% of callers were provided with emotional support and distress management and 12% of callers were provided with mental health support.  Multilingual Lines is DCGT's second-biggest helpline, providing support in eight languages: English, Cantonese, Mandarin, Portuguese, Spanish, Hindi, Punjabi, and Urdu. The program answered 25,751 calls related to loneliness/social contact (66%), relationships (52%), isolation (38%), self-esteem/self-worth (34%), and other issues. The charity also runs other helpline services. Talk Suicide, which focuses on individuals at risk of suicide, answered 14,471 texts and calls in F2022. Partnership Lines, a program that works with the TTC to encourage anyone contemplating suicide to contact DCGT, answered 1,787 calls.  DCGT also runs outreach programs that call clients to provide safety check-ins, medication reminders, and emotional support. The Tele Check and Caller Reassurance programs supported 414 and 98 seniors in need respectively in F2022. Touching Base program provides similar support to 269 clients with mental health concerns in F2022.",Distress Centres of Greater Toronto reports that 25% of 408-Help Line callers experienced a decrease in isolation and loneliness and 37% reduced emotional intensity following the conversation with DCGT staff in F2022. DCGT's Multilingual Lines service helped 162 calls (0.6%) de-escalate an immediate crisis and 277 calls (1%) decrease harmful intentions.
66,Doctors Without Borders,https://www.charityintelligence.ca/media/charity_logos/DWB_colour_72.jpg,5,2,B+,79%,Toronto,ON,www.msf.ca,416-964-0619,International Aid,"Humanitarian Relief and Disaster Response, Healthcare and Medical Services","Doctors Without Borders Canada is a top-rated, 5-star charity. It has High impact and is a Top International Impact charity. Doctors Without Borders is consistently one of Charity Intellignece's top pick charities in emergency situations and crisis response, with a great track record in speed, effectiveness and reporting.  Founded in 1971, Doctors Without Borders / Médecins Sans Frontières (MSF) aims to reduce suffering, save lives, and provide medical care where it is needed most. It comprises 24 national offices, which work in more than 65 countries. MSF’s charter states that it helps people regardless of their race, religion, or political affiliation. Doctors Without Borders Canada (MSF Canada) is the Canadian branch of MSF, funding projects in 34 countries around the world. Ci's special report on Ukraine: How to help A Charity Intelligence 2022 Top 10 International Aid Impact Charity Doctors Without Borders focuses on providing medical care to victims of armed conflict, epidemics, forced migration, and disasters. It runs both immediate humanitarian relief projects and longer-term medical programs that treat diseases such as cholera, HIV/AIDS, and measles. Finally, MSF’s advocacy arm raises awareness on issues relating to human rights abuses and healthcare inequality. MSF Canada provides spending figures by country, not broken down by program area. In 2020, MSF provided 9,904,200 outpatient consultations, facilitated 1,026,900 emergency room admissions, and assisted 306,800 births. It provided 112,000 outpatient consultations for covid-19 and admitted 15,400 covid-19 patients. It also treated 2,690,600 malaria cases and 8,300 cholera cases. In 2020, the charity’s three largest focus countries, in order of program spending, were the Democratic Republic of the Congo, South Sudan, and Yemen. In the Democratic Republic of the Congo, MSF provided humanitarian and medical assistance in 16 of 26 provinces. MSF conducted 1,694,100 outpatient consultations, provided 567,800 vaccinations against measles, and treated 4,140 people for cholera. MSF helped respond to an Ebola outbreak and treated 199 Ebola patients. MSF’s projects in South Sudan supported 7.5m people in need of humanitarian assistance due to escalating violence, covid-19, severe flooding, and food insecurity. MSF ran 16 projects in South Sudan in 2020. In response to severe flooding, MSF distributed 60,000 litres of drinking water per day where floodwater contaminated wells. MSF conducted 688,000 outpatient consultations, treated 195,300 malaria cases, and admitted 54,300 people to the hospital. In Yemen, MSF staff run 12 hospitals and health centres to help victims of the Yemeni Civil War, which has been ongoing since September 2014. It also provides funding and support to 24 other health centres across 13 states. In January 2020, a patient in an MSF-supported hospital in Taiz City was killed. This type of violence made it difficult for MSF to help those in need. In 2020, MSF conducted 250,300 outpatient consultations, performed 26,600 medical interventions, and assisted 23,400 births.",Doctors Without Borders Canada has not yet posted its 2021 annual report at the time of this update. These results refer to 2020.
67,Downtown Mission of Windsor,https://www.charityintelligence.ca/media/charity_logos/logo%20downtown%20mission%20windsor.png,4,2,B,81%,Windsor,ON,www.downtownmission.com,519-973-5573,Social Services,"Homelessness and housing assistance, Youth programs, Food banks and hunger relief, Rehabilitation centers and addiction services","Downtown Mission of Windsor is a 4-star charity. It is financially transparent and has overhead costs within Ci's reasonable range and an average results reporting. Founded in 1972, Downtown Mission of Windsor (Downtown Mission), formerly known as the United Church Downtown Mission of Windsor, is a Christian charity that supports poor and homeless people in Windsor, Ontario. The charity states that approximately 200 people are homeless in Windsor-Essex every night. Downtown Mission runs five programs: sanctuary, food support, enterprise, youth services, and wellness. Its head office is in Windsor, ON. Sanctuary program – 48% of program cost: The sanctuary program provides emergency overnight shelter for homeless people. The charity offers residents free showers, clothing, and hygiene supplies during their stay. In F2022, Downtown Mission provided 26,187 overnight stays. In F2022, 12,908 adults and 1,143 youth received clothing and hygiene supplies. Food Support – 25% of program cost: Food Support services include hot meals, a food bank, and the FRESH program. The FRESH program rescues food from local farmers and grocery stores and delivers them to schools, food banks, and other organizations. In F2022, Downtown Mission saved 1,935,101 pounds of food and distributed it to 25 local schools and agencies. The charity also served 103,221 hot meals and provided 316,365 meals through its food bank in F2022. Enterprise program – 12% of program cost: The Enterprise Program enables participants to target their career goals, receive training, and develop employment skills. The charity reports that it helped 48 individuals become “job-ready” in F2022. Youth Centre – 11% of program cost: The Windsor Youth Centre supported 2,782 youth in F2022 and referred 362 youth to partner agencies. Wellness program – 4% of program cost: The Wellness program supports people with drug addictions. In F2022, the charity supported 175 adults and 180 youth through their recovery journey.","In F2022, Downtown Mission of Windsor reports that it reversed 121 opioid overdoses in F2022, compared to 128 in F2021. The charity also found permanent housing for 51 homeless people during the same year."
68,Ducks Unlimited Canada,https://www.charityintelligence.ca/media/charity_logos/1.png,4,2,A,73%,Stonewall,MB,www.ducks.ca,1-800-655-3825,Environment,"Nature conservation, Environmental education and awareness","Ducks Unlimited Canada is a 4-star charity with an above-average results reporting grade. The charity has reasonable overhead costs and is financially transparent.  Founded in 1938, Ducks Unlimited Canada (DUC) works to “conserve, restore, and manage wetlands and other habitats for North America’s waterfowl.” DUC says that wetlands are one of the most important ecosystems on the planet, but up to 70 percent of wetlands have been lost in settled areas of Canada. Ducks Unlimited Canada is affiliated with the US-based Ducks Unlimited and the two charities collaborate on some projects. In Canada, DUC states that it has influenced 228.2 million acres of land, conserved and restored 6.2 million acres and completed 12,329 habitat conservation projects since 1938. Its head office is in Winnipeg, MB. Ducks Unlimited Canada’s spending on programs includes habitat conservation and revolving land; and research, education and government relations. Habitat Conservation and Revolving Land – 92% of total program spending: DUC’s habitat conservation projects include work with wetlands, grasslands, water, waterfowl, wildlife, and Canada’s Boreal in all provinces across the country. In F2022, DUC conserved 109,062 acres of land, including 40,837 acres restored. It also influenced 33.7 million acres of land through partnership and policy. In F2023, the charity aims to conserve 145,346 acres of land and influence 4.1 million acres across the country. Research, Education, and Government Relations – 8% of total program spending: Along with its conservation work, DUC also approaches the problem of the ecosystem through science, education, and policy. Its research projects focus on habitats that support waterfowl populations and how those lands affect other wildlife and improve human lives. Since 1938, it has led or participated in more than 300 studies throughout North America, generating nearly 750 scientific publications. For Education, in F2022, DUC launched two new Wetland Centres of Excellence, teaching students conservation knowledge like planting native species, testing water quality, and exploring wildlife. For Advocacy, the charity has a long history of influencing large-scale conservation programs in Canada.","Ducks Unlimited Canada reports that it secures important at-risk wetlands, restores those that have been damaged and drained, and manages the areas under its care. DUC conserved a total of 109,062 acres of habitat and positively influenced 33.7 million acres of habitat across Canada in F2022."
69,Earth Rangers Foundation,https://www.charityintelligence.ca/media/charity_logos/earth_rangers_logo.jpg,4,2,B,71%,Woodbridge,ON,www.earthrangers.org,905-417-3447,Animal Welfare,Increasing public awareness,"Earth Rangers Foundation is a 4-star rated, financially transparent charity. It has an average results reporting grade and its overhead spending is within Ci’s reasonable range. The charity has $3.9m in reserve funds, which can cover 11 months of program costs. Founded in 2000, Earth Rangers Foundation (Earth Rangers) aims to create a generation of conservationists. Earth Rangers reports that the biggest environmental concern for children is protecting animals from extinction. The charity teaches children about the environment and animals and encourages optimism about the future. Earth Rangers Foundation has three main programs: the School Assembly program, The Earth Rangers program, and Conservation. The charity does not disclose how much it spends on each program. The School Assembly program delivers in-person and online school assemblies and class presentations for children in grades one to six. The program features live animals and teaches students about biodiversity and conservation initiatives in Canada. In F2022, Earth Rangers delivered 722 school presentations. Since 2010, the School Assembly program has reached 2,151,904 students. The program also has educational resources such as the Earth Rangers podcast. The podcast had 1,405,000 downloads in F2022. The Earth Rangers program requires children to sign up to become an Earth Ranger. The charity provides its members with activities, communications, and conservation projects through the Earth Rangers app. Members receive tasks focused on environmental issues, called missions. In F2022, 32,000 new members signed up and members completed a total of 92,700 missions. They logged 381,400 climate-friendly habits, 107,000 of which related to reducing energy usage at home and 122,000 of which were forest-friendly habits. Earth Rangers Foundation’s Conservation program works with other organizations and researchers to protect species and habitats at risk in Canada. In F2022, the charity supported seven conservation projects. Funds are raised through the sale of adoption kits. Each adoption kit purchase represents the symbolic adoption of an endangered animal. The charity reports 4,200 symbolic adoptions in F2022.",
70,East York Learning Experience,https://www.charityintelligence.ca/media/charity_logos/EYLE_Logo.jpg,5,2,A-,96%,Toronto,ON,www.eyle.toronto.on.ca,416-425-2666,Education,Schools and education institutions,"East York Learning Experience is a 5-star charity with an above-average results reporting score and High demonstrated impact. It is financially transparent and has overhead spending outside Ci's reasonable range.  Founded in 1987, East York Learning Experience (EYLE) helps adults improve their reading, writing, basic math, and digital literacy skills. The charity reports that 42% of Canadian adults between 16-65 years old have low literacy skills that prevent them from applying for jobs, reading the newspaper, writing letters, filling out forms, and banking. EYLE’s programming consists of one-on-one tutoring sessions with trained volunteer tutors to improve literacy and numeracy skills. Since 1987, EYLE has helped over 1,200 people improve their lives. A Charity Intelligence 2022 Top 10 Canadian Impact Charity Through its education services, EYLE manages 40-50 active learner/tutor pairs at a time. EYLE’s services are offered free of charge to clients and follow the Ontario Adult Literacy Curriculum Framework. After a student leaves the program, EYLE follows up with them at the 3, 6 and 12-month mark to monitor their success. Staff develop an individualized training plan for each student based on their background, former education, work experience, goals, and literacy assessment results. The charity teaches reading, writing, numeracy, critical thinking, oral communication, and computer use/digital skills. EYLE hopes to provide students with the foundation for learning other skills, allowing them to find and maintain a job. EYLE reports that it operates efficiently by using a modest budget to support a team of volunteers. EYLE has a team of 60 volunteer tutors who give an estimated $130,000 in tutoring hours each year. The charity reports that if it were to pay its volunteers, its costs would rise by 87%. The volunteers allow the charity to operate with only two full-time and two part-time paid staff. EYLE operates out of a low-rent facility designed specifically for nonprofits to further keep costs down.",East York Learning Experience reports that 4% of the clients who exited its program in F2022 found employment. A further 39% transitioned to further training/education such as adult high school or college.
71,Ecojustice,https://www.charityintelligence.ca/media/charity_logos/Ecojustice%20Logo.jpg,4,2,B-,77%,Vancouver,BC,www.ecojustice.ca,604-685-5618,Environment,"Climate change, Animal protection, Nature conservation  ","Ecojustice is a 4-star rated charity with a below-average results reporting score. It is financially transparent and has overhead costs within Ci’s reasonable range. Founded in 1991, Ecojustice uses legal action to defend nature and fight climate change. Through its legal cases, Ecojustice aims to establish laws and rulings that protect environmental rights. The charity’s main office is in Vancouver, with four regional offices in Calgary, Halifax, Ottawa, and Toronto. Ecojustice has fought a total of 113 cases, of which 58 were victorious, 32 are in progress, 21 are closed, and two are under appeal. Ecojustice groups its advocacy into three main program areas: Climate, Healthy Communities, and Nature. It did not provide a spending breakdown for its programs in F2022. Ecojustice’s Climate program pursues legal action relating to global warming, carbon emissions, and weak climate regulation. The charity advocates for serious climate action to stop the long-term effects of climate change. The Healthy Communities program involves legal cases that deal with pollution, chemical waste, and local sustainability. The charity’s Nature program urges governments to protect oceans, watersheds, forests, and other vital habitats. Ecojustice also protects national parks from projects that would threaten native wildlife.","Under its Climate program, Ecojustice helped propose Bill C-12 (Canadian Net-Zero Emissions Accountability Act), which was passed in June 2021. This Act requires that the federal government hold all levels of government accountable for reducing greenhouse gas emissions."
72,Ecotrust Canada,https://www.charityintelligence.ca/media/charity_logos/Ecotrust_Canada_Logo_2020.png,5,2,A-,88%,Vancouver,BC,www.ecotrust.ca,604-682-4141,Environment,"Animal protection, Climate change","Ecotrust Canada is a 5-star charity with an above-average results reporting grade. It is financially transparent and its overhead spending is within Ci’s reasonable range. The charity has reserve funds of $4.0m which can cover a year and two months of annual program costs. Founded in 1995, Ecotrust Canada aims to create a sustainable economy in Canada by funding innovative solutions to environmental and social problems. The charity works with rural, remote, and Indigenous communities to develop methods of improving sustainability. In F2022, Ecotrust Canada had five main programs: Community Fisheries, Food Systems, Community Energy, Climate Innovation, and Indigenous Homelands. In F2022, Ecotrust Canada spent 36% of program costs on Community Fisheries. The charity aims to build a sustainable and vibrant commercial fishery system in BC by advocating for policy change, managing local fisheries, and stopping illegal fishing. Food Systems represented 17% of program costs in F2022. Through this program, the charity aims to improve food access and security in Prince Rupert and the Pacific Northwest of BC. In F2022, Community Energy represented 14% of program costs. This program uses clean energy solutions to put an end to energy poverty. Climate Innovation represented 11% of program spending in F2022. Through this program, the charity works with rural and Indigenous communities to mitigate climate change and support biodiversity. In F2022, the charity allocated 8% of program spending to Indigenous Homelands. The program supports Indigenous groups in developing culturally, environmentally, and economically resilient housing and land governance practices. The remaining 14% of program costs consisted of Strategy and Community Development (8%), and Social Enterprises (6%).","In F2022, Ecotrust Canada recorded around 4.3 million sockeye salmon returning to the Skeena River, the highest number in 15 years. The charity reports that the wild salmon industry in British Colombia employs over 6,600 people."
73,Eden Food for Change,https://www.charityintelligence.ca/media/charity_logos/Eden-Food-For-Change-Logo.jpg,5,2,A-,80%,Mississauga,ON,www.edenffc.org,905-785-3651,Social Services,Food banks and hunger relief,"Founded in 2002, Eden Food for Change (EFFC) hopes to increase access to good food in a dignified manner, to develop food skills to encourage healthy eating and to empower the community through education, outreach and advocacy. In 2014, EFFC moved away from the typical food bank model of food collection and distribution. Its programs now favor a relational long-term approach that provides food for hungry people and encourages the entire community to access nutritious food and food skills. EFFC primarily serves western Mississauga. Eden Food for Change’s Food Bank program allows individuals to pick up 7 to 10 days of food each month. In F2018, 492,599 pounds of food were distributed through the Food Bank, of which about 50% was fresh produce. In F2018, the food bank also reports that 27,567 pounds of food were shared with other organizations, and 5,320 pounds was repurposed food waste for farm and compost use. The food bank was able to facilitate 17,235 individual visits, a 28% increase from F2017 and 5,608 family visits, a 15% increase from F2017.   Eden Food for Change’s Fresh Produce Box program offers community members fruits and vegetables for pickup at discounted prices. In F2018, the program distributed 5,090 produce boxes to clients, which is down from 12,668 boxes distributed in F2017.    Finally, Eden Food for Change’s Learning Kitchen program teaches cooking skills and nutritional education to its food bank participants. The Learning Kitchen also offers cooking classes to community members, that teach basic kitchen and food preparation skills. The food that is prepared through these classes is distributed through EFFC’s Food Bank program. In F2018, 861 individuals participated in classes in groups, which produced 37,938 portions of food for the Food Bank. The Learning Kitchen also provides lunches to children from low-income neighbourhoods and employs people seeking jobs in the food service industry.",Charity Intelligence has given Eden Food for Change a Good impact rating based on demonstrated impact per dollar spent.
