id,charity_name,logo,rating,financial_transparency,results_reporting,cents_to_cause,city,province,website,Tel,main_category,sub_category,new_overview,new_results_and_impact
130,Lifewater Canada,https://www.charityintelligence.ca/media/charity_logos/LifeWater%20Canada%20Logo_Colour%20(002).jpg,5,2,A,95%,Thunder Bay,ON,www.lifewater.ca,1-807-622-4848,International Aid,Clean Water and Sanitation,"Lifewater Canada is a top rated 5-star charity and a top 10 impact charity. It has a high results reporting score and is financially transparent. The charity does not have large funding reserves and can cover less than 4 months of program costs.  Founded in 1997, Lifewater Canada is a volunteer-based Christian charity that works to improve hygiene and provide safe drinking water to people in Kenya, Liberia, Nigeria, and Haiti. It sends trained teams into communities without access to clean or safe water to build wells, water pumps, community toilets, and rainwater storage systems. It also teaches locals how to use and maintain this equipment. Lifewater Canada reports that around 785 million people lack access to safe water and that 2.4 billion people lack access to toilets and hand-washing stations. Women and young girls are particularly affected by this crisis. Collectively, they spend 200 million hours per year gathering water. This leads to many young girls dropping out of school. Diseases like cholera, dysentery, and typhoid are transmitted through dirty water and kill 1.6 million people annually. This is equivalent to one person dying every 20 seconds. Most of these deaths are children under the age of five. In F2022, Lifewater Canada helped 970,602 people through 2,093 clean water and sanitation projects. Including donated goods, it spent $3.1m on its programs. Ci estimates that the total program cost for each project is $1,485.  Lifewater Canada spent $2.3m on projects providing safe water in F2022. This represents 73% of its program costs. In F2022, it built 355 new wells and fixed 314 wells. Lifewater Canada repaired 1,138 hand pumps, up from 588 in F2021. It also installed 268 rainwater collection tanks, an increase from 79 in F2021. Lifewater Canada spent $523k on infrastructure improvements. This represents 17% of its program costs. This includes storage facilities and other equipment needed to carry out its projects.  In F2022, it spent $202k on sanitation, health, and hygiene projects representing 6% of program costs. During the year, it held 658 health and hygiene workshops that reached 262,354 people. It also built 284 handwashing stations and 19 toilets. It also spent $130k on disaster relief in Ukraine representing 4% of program costs. Listen to CBC's November 2022 interview with Lifewater Canada's Lynda Gehrels on well drilling in Kenya, cost per well, pump repair updates in Liberia and 85 new water proposals per month in Nigeria.","In F2022, Lifewater Canada reports that adults and children saved 143,242 hours each day because they no longer needed to walk long distances to get water. Its projects helped children spend 556,163 more hours in school each month instead of getting water. Girls spent 69,520 more days in school each month instead of fetching water."
131,Lions Foundation of Canada Dog Guides,https://www.charityintelligence.ca/media/charity_logos/Logo%20LFCDG.png,4,2,A,69%,Oakville,ON,www.dogguides.com,905-842-2891,Social Services,Disability services,"Lions Foundation of Canada Dog Guides is a 4-star charity. It is financially transparent, has overhead spending within Ci's reasonable range, and has a strong results reporting grade. Lions Foundation of Canada Dog Guides has $16.4m in reserve funds, which can cover just under four years of program costs. Founded in 1983, Lions Foundation of Canada Dog Guides is a dog training school and charity that connects clients with disabilities to specialized dog guides. The charity strives to make disabled clients feel more independent and empowered thanks to dog guides. The Foundation and Dog Guides Canada merged in August 2021 and now operate under the Foundation's name. Lions Foundation of Canada Dog Guides has two training facilities in Ontario: one in Oakville and another in Breslau. Lions Foundation of Canada Dog Guides reports that one in five Canadians over 15 years of age are living with one or more disabilities. The charity provides its trained dogs to eligible Canadians at no extra cost. Dog guides receive specific training to meet the needs of their clients. The charity offers seven Dog Guide programs: Canine Vision (for the blind or visually impaired), Hearing (for the deaf or hard of hearing), Autism Assistance (for children on the autism spectrum), Service (for those with medical or physical disabilities), Seizure Response (for those with epilepsy), Diabetic Alert (for those with diabetes), and Facility Support (for professional agencies that support victims with trauma). Lions Foundation of Canada Dog Guides reports that it had 1,018 active client-dog guide teams in F2022 and had 85 dogs in training. Additionally, the foundation supported 215 foster families raising future guide dogs and has 155 active dog sitters. It adds that 236 puppies were born in F2022 and they had 1,422 veterinary visits. Lions Foundation of Canada is hoping to open a new facility in Oakville in 2025, which will increase its dog training capacity.","In F2022, Lions Foundation of Canada Dog Guides reports that there were 73 graduating client-dog guide teams. It adds that this is more than double the number of graduating teams in F2021, which was 35. The charity aims to graduate 250 teams a year by 2025, once its new facility in Oakville opens."
132,Lung Health Foundation,https://www.charityintelligence.ca/media/charity_logos/LHF-Logo_.jpg,4,2,B,73%,Toronto,ON,www.lunghealth.ca,416-864-9911,Health,Patient support and advocacy charities,"Lung Health Foundation is a 4-star charity with an average results reporting grade. It is financially transparent and has overhead costs within Ci’s reasonable range.   Founded in 1945, the Canadian Lung Association and its provincial partners work to promote lung health and advancements in respiratory care. In January 2020, Ontario Lung Association separated from being a provincial branch of the Lung Association and became Lung Health Foundation (LHF). The charity reports that one in five Canadians live with lung disease. Lung Health Foundation provides programs and services and funds research. The charity focuses on five areas of lung health: Asthma, Chronic Obstructive Pulmonary Disease (COPD), Lung Cancer, Infectious Respiratory Disease, and Smoking/Vaping Prevention and Cessation. Programs and Services accounted for 92% of LHF's program spending in F2023. The charity focuses on support for people with lung diseases (Programs and Support), public education, advocacy, and supporting healthcare professionals (Practice Change). LHF does not provide a breakdown of its spending on its programs.  Within Programs and Support, the charity has a Lung Health Line, Fitness for Breath program, Community Support Groups and other services. The Lung Health Line connects people seeking more knowledge about lung healthcare with professionals. In F2023, the charity had more than 500 one-on-one sessions. The charity reported that it supported 1,702 Canadians through its programs in F2023. In F2023, within Public Education, Lung Health Foundation ran five awareness and education campaigns. The charity also hosted ten education sessions attended by 260 patients and caregivers. Through its Advocacy, LHF runs campaigns to raise awareness about lung disease. In F2023, as part of its first federal lobbying effort, the charity communicated with 24 elected officials. Additionally, 160 lung health stakeholders were reached through Policy Forums.  Lung Health Foundation also works with healthcare professionals under its Practice Change program. In F2023, the charity hosted 75 information sessions for 1,570 professionals. LHF also provided healthcare professionals with 21 clinical tools and resources to improve the quality of care. Research represented LHF’s remaining 8% of program spending. In F2023, Lung Health Foundation provided 20 grants, bursaries, and fellowships to support research in lung health. In F2023, the charity welcomed 50 researchers into the new LHF Research Lab.",
133,Lymphoma Canada,https://z9a2f9c2.rocketcdn.me/wp-content/uploads/2020/01/lymphoma-logo.png,4,2,B,69%,Mississauga,ON,www.lymphoma.ca,905-858-5967,Health,"Medical Research, Palliative care, Patient support and advocacy charities","Lymphoma Canada (LC) formed from a merger in 2000 between Lymphoma Research Foundation of Canada and Canadian Lymphoma Foundation, both of which were founded in 1998. Lymphoma Canada works to improve the lives of people affected by lymphoma. There are over 60 different types of cancers of the lymphatic system which affect over 100,000 Canadians. Doctors classify lymphoma into two general categories: Hodgkin and non-Hodgkin (NHL). Hodgkin lymphoma is rare, while NHL is the fifth most common cancer diagnosed in Canada. Lymphoma Canada runs four programs: Patient Education, Patient Support, Research, and Advocacy.       Patient Education accounted for 53% of Lymphoma Canada’s program spending in F2020. LC runs webinars and forums to keep patients and caregivers up to date on new treatment options, how to manage symptoms, and challenges that come with survivorship. LC hosted 11 educational webinars across Canada in 2020. LC also distributed over 3,500 patient resource manuals in F2020. Each manual details one of the three main subtypes of lymphoma.       Patient Support represents 36% of program spending in F2020. Peer-to-Peer Mentoring is a service offered through this program that matches lymphoma patients and caregivers to survivors. Lymphoma Canada also runs support groups. In 2020, LC relaunched an app, The CLL Watch & Wait, which allows patients to track Chronic Lymphocytic Leukemia (CLL) symptoms. In F2020, Lymphoma Canada also created a covid-19 hub to help guide lymphoma patients on covid related topics.       Research is Lymphoma Canada’s third largest program, accounting for 7% of program spending. LC awarded its Lymphoma Canada Research Grant to one research group in F2020. The recipients were Drs. Rob Laister and Sam Saibil from the Princess Margaret Cancer Centre. The researchers focus on CAR-T therapy, or Chimeric Antigen Receptor T cell therapy, a type of immunotherapy that modifies a patient’s T cells to better detect and destroy lymphoma.       Advocacy accounted for the final 4% of program costs in F2020. LC advocates for equal access to lymphoma treatments for all Canadians. In F2020, LC wrote letters to each of the provincial and territorial Ministers of Health advocating for equal access to CAR-T treatments across Canada.",Lymphoma Canada funded researchers who published a study in Nature Medicine in February 2020. The researchers discovered that diffuse large B-cell lymphoma cells with an altered gene respond better to lymphoma treatment.
134,MADA Community Center,https://www.charityintelligence.ca/media/charity_logos/MADA_logo.jpg,5,2,B+,90%,Montreal,QC,www.madacenter.com,514-342-4969,Social Services,"Food banks and hunger relief, Rehabilitation centers and addiction services  ","Founded in 1993, MADA Community Center (MADA) is a Jewish charity that works to fight poverty in Montreal, QC. MADA reports that there were 18,130 Jews living below the poverty line in the Montreal metropolitan area as of 2011. The poor make up 20% of the total local Jewish population. MADA Community Center thus works to provide these people in need with basic necessities while bringing the Jewish community closer together. MADA’s programs include a foodbank (now known as Chez Makolet), a cafeteria, Shabbat to Share, social events, and a clothing and furniture depot. The charity notes its services are provided at no cost to program participants. In F2019, MADA reported having a total of 5,923 members.  Foodbank: In F2019, spending on MADA's foodbank, Chez Makolet, made up 31% of total program spending. The food bank offers a variety of free items, like produce, non-perishables, and household essentials, to people in need. In F2020, MADA provided approximately $30 million worth of food to people in need. Cafeteria: MADA Community Centre’s cafeteria made up 29% of total program spending in F2019. The cafeteria serves three meals, 365 days a year, to those in need. MADA reports that as of 2020, it has provided over one million food servings, including hot meals delivered to people's homes and served in the cafeteria.  Shabbat to Share: In F2019, MADA’s Shabbat to Share program made up 16% of program spending. Each week, MADA volunteers visit elderly people with special needs to deliver a Shabbat meal. In F2019, MADA reports that 44,100 Shabbat to Share meals were delivered. MADA hopes to provide 30% of the Montreal Senior Jewish Community with Shabbat to Share meal boxes in 2021, with an ultimate goal of reaching 100% of the population by 2030. Other Programs: MADA runs two other major programs: Social, Educational and Special Events (15% of spending in F2019); and Clothing and Furniture Distribution (9% of spending). Special Events programs strive to ensure no one is left alone at home during Jewish holidays. At Rosh Hashana and Passover, thousands of people gather at MADA’s centres for festive meals and celebrations. MADA also runs a Care & Call program, which involves volunteers calling to check in on Jewish clients of MADA who have no social support. The charity's clothing and furniture depots carry gently-used items members can obtain for free, such as clothing, household items, children’s toys, furniture, and appliances. In 2020, MADA reports distributing approximately 130,000 used clothing items, and 3,000 used furniture items.","In F2020, MADA reports delivering over 12 million pounds of food (compared to 13.7 million in F2019) to families in need. Since covid-19, MADA has delivered over 650,000 meals to families, elders, and people quarantining."
135,MakeWay,https://www.charityintelligence.ca/media/charity_logos/MakeWay Logo 2020.png,4,2,B,90%,Vancouver,BC,www.makeway.org,604-647-6611,Environment,"Nature conservation, Environmental education and awareness","MakeWay is a 4-star charity. It  is financially transparent and has a B results reporting grade, which is average. For every dollar donated to the charity, 90 cents are available to go to the cause.  Founded in 2000, MakeWay funds various projects that help people and nature thrive together. MakeWay consists of two separately registered charities: MakeWay Charitable Society and MakeWay Foundation. Before June 2020, MakeWay was known as Tides Canada. Based on the model of Tides Foundations in the US, MakeWay sets up partnerships with local groups, leaders, foundations, and governments to protect nature. In F2022, MakeWay spent $30.5m on its programs. MakeWay reports it partnered with 200 foundations, 150 businesses, 50 governments, and over 2,500 individuals through its programs in F2022. The charity launched the Fair Earth Living funder collaborative in F2022. The goal of this project is for Canadians to live more sustainably and within the means of Earth’s renewable resources. The project focuses on changing behaviour, particularly consumption, and advocating for sustainable policy changes. MakeWay’s three largest spending areas are Shared Platform programs, Pacific programs, and Northern Canada programs. Shared Platform: Shared Platform represents 79% of program spending. MakeWay’s Shared Platform program partners with individuals who have a project in line with the charity’s mission. Its shared platform provides the project with governance, HR assistance, financial and risk management, grant management, and charitable expertise. To be a part of MakeWay’s shared platform, the project must have an annual budget of more than $100k. Each project is responsible for its own fundraising and revenue generation, with 12% of revenue contributing to shared overhead cost. The charity reports it hosted over 70 shared platform projects across Canada in F2022. MakeWay closed five Shared Platform Projects in F2022. One project, the Healthy Watershed Initiative, supported 61 projects, employed over 750 people, and supported watershed work across BC. Pacific and Northern Canada: Pacific programs represent 10% of program spending and Northern Canada programs represent 5% of program spending. MakeWay supported the development and implementation of over 59 Indigenous guardian programs in the North and Pacific in F2022. The remaining 6% of program spending includes Northern Manitoba Food, Culture, and Community Collaborative; and National Programs and Advisory Services.",Charity Intelligence was unable to find any quantified outcomes on MakeWay's programs. This may not be a complete representation of Makeway's results and impact.
136,Mazon Canada,https://www.charityintelligence.ca/media/charity_logos/MAZlogo.jpg,4,2,B+,73%,Toronto,ON,www.mazoncanada.ca,416-783-7554,Social Services,"Food banks and hunger relief, Rehabilitation centers and addiction services  ","Founded in 1987, Mazon Canada (Mazon) supports Jewish and non-Jewish food projects across Canada. With headquarters in Toronto, Mazon awards grants to organizations that are small and in need, operate in rural communities, support vulnerable populations, serve healthy food, and are working towards ending food insecurity in Canada. The charity notes that every year, four million Canadians face food insecurity, with one in six of those individuals being a child under 18. Its vision is for Jews to join other Canadians to ensure everyone can live a hunger-free life. Mazon Canada awards grants in four main categories: Grocery, Garden, Gear and Advocacy. In F2020, Mazon Canada granted a total of $838k. As per Mazon's most recent (F2019) T3010a filing with the CRA, the top three grant recipients were York Region Food Network ($12k), Ve'ahavta ($12k), and Toronto Foundation for Student Success ($11k). Grocery Grants: Mazon Canada notes this program as being the most urgent aspect of its work. These grants are awarded to organizations buying food directly for people in need. In F2020, Mazon served an average of 1,000 meals per day through its 198 partners. Meals were delivered through the 18 school programs, 94 food banks, 28 hot meal programs, 20 meal delivery programs, and six community kitchens Mazon supported in F2020. Garden Grants: In F2020, Mazon supported six community gardens. Through this program, Mazon funds supplies for community gardens that teach people how to grow their own food or harvest food for other organizations feeding people in need. Mazon reported supporting seven organizations with Gear Grants in F2020. Gear Grants fund equipment for food projects to increase capacity to feed those in need, such as new refrigerators or freezers. Mazon also awarded its first-ever Advocacy Grant to the Coalition for Healthy School Food. This grant supported research on the effects of pandemic school closures on school food programs and their dependants, in F2020.","In F2020, Mazon Canada reported providing over $200k of direct covid-19 aid, which included food hampers, grocery gift cards, prepared meal deliveries and street outreach meals. This aid provided 110,000 meals to people in need. The charity also notes that 900,000 food insecure people are affected by a Mazon partner program annually."
137,McGill University,https://www.mcgill.ca/visual-identity/files/visual-identity/mcgill_sig_red.jpg,5,2,A,73%,Montreal,QC,www.mcgill.ca,514-398-4455,Education,Schools and education institutions,"McGill University is a top-rated five-star charity and one of Canada's largest charities. As with most large universities, it has a high results reporting grade and is financially transparent. The university's gross funding reserves can cover program costs for around 6 months. Founded in 1821, McGill University (McGill) is a public university in Montreal. McGill has three campuses: a downtown Montreal campus, a Macdonald campus, and the Gault Nature Reserve for wildlife research. McGill has more than 80 departments. It offers over 300 undergraduate and 400 graduate programs of study. McGill’s main programs are education and research, for which it does not provide a spending breakdown. In fall 2022, McGill University had 39,513 enrolled students. This included 27,085 undergraduate students and 10,344 graduate and PhD students. It hosted 1,432 residents and fellows and 647 postdoctoral scholars. McGill reports that around 47% of its students are from Quebec, 23% are from the rest of Canada, and 30% are from outside Canada. In 2021, McGill awarded 5,960 undergraduate degrees, 1,247 master’s degrees and 517 doctoral degrees. In fall 2022, McGill reported to have 1,778 tenured and tenure-stream faculty members. As of F2022, McGill is home to 182 Canada Research Chairs. The university has 234 active fellows of the Royal Society of Canada. In 2021 McGill researchers authored 10,464 published papers.","According to the 2023 Maclean’s University Rankings, McGill University is the top medical-doctoral university in Canada. McGill has retained this ranking for 18 consecutive years. In 2023, McGill also ranked 31st in the QS World University Rankings and 46th in the Times Higher Education World University Rankings."
138,McMaster University,https://upload.wikimedia.org/wikipedia/en/thumb/5/53/McMaster_University_logo.svg/1200px-McMaster_University_logo.svg.png,5,2,A,94%,Hamilton,ON,www.mcmaster.ca,905-525-9140,Education,Schools and education institutions,"Founded in 1887, McMaster University (McMaster) is a public university in Hamilton. The school is named after Senator William McMaster, founding president of the Canadian Imperial Bank of Commerce, who funded its creation through a $900k bequest. Today, McMaster is a research-intensive university with six main faculties: business, engineering, health sciences, humanities, science, and social sciences. Its main programs are education and research, for which it does not provide a spending breakdown. In fall 2020, McMaster University had 36,450 enrolled students, including 31,533 undergraduates and 4,917 graduates. Around 16% of its student population consists of international students. McMaster has 1,050 faculty members, of which 32% teach health sciences, 20% teach science, and 17% teach engineering. McMaster University is home to 88 Canada Research Chairs. Its researchers also include 118 endowed research chairs, two Ontario Research Chairs, and a Canada 150 Research Chair. McMaster states that it ranks first across universities in Canada for faculty research intensity, based on research spending per faculty member. In F2020, it spent $404k per faculty member and $75k per graduate researcher. McMaster publishes an annual Community Engagement Report to highlight local projects that it funds across Greater Hamilton. The McMaster Access Program works with local school boards to help underrepresented students plan for their postsecondary education. In F2020, it reached more than 400 local students through recruiting events and hosted 70 one-on-one academic advising sessions.","In April 2019, McMaster University completed an impact evaluation with KPMG. Its impact assessment found McMaster contributes around $1.6 billion in GDP and 14,000 full-time jobs to Ontario’s economy each year through its spending. Including the indirect effects of spending, KPMG estimated that McMaster’s total economic impact is around $9.2 billion each year."
