id,charity_name,logo,rating,financial_transparency,results_reporting,cents_to_cause,city,province,website,Tel,main_category,sub_category,new_overview,new_results_and_impact
196,Street Health,https://www.charityintelligence.ca/media/charity_logos/street_health_logo-400x124.jpg,5,2,A,94%,Toronto,ON,www.streethealth.ca,416-921-8668,Social Services,Homelessness and housing assistance,"Street Health is a top-rated, 5-star charity with astrong results reporting grade and Good demonstrated impact. The charity has reasonable overhead costs and is financially transparent.  Founded in 1986, Street Health is a frontline service to help Toronto's homeless population. The charity states that roughly 10,0000 people in Toronto are homeless or insecurely housed each night. Street Health runs five main programs: harm reduction, mental health, nursing, overdose prevention, and identification (ID) services.  In F2023, Street Health spent 39% of total program spending onharm reductionfor drug users. Through its programs, Street Health aims to reduce the negative consequences of drug use without necessarily reducing drug use itself. Services include outreach, safe drug kit distribution, drop-ins, Hepatitis C clinics, and community clean up. In F2023, the Community Harm Reduction Response Team made 5,158 contacts. Additionally, Street Health supported 6,243 client visits to 151 harm reduction drop-ins in F2023. The charity also distributed 767,036 harm-reduction kits.  Street Health allocated 28% of program spending tomental health counsellingin F2023. The charity's community health workers provide long-term case management support for people with mental health issues. The program serves people who are homeless or at risk of becoming homeless.  In F2023, Street Health allocated 15% of program spending tonursingservices. Registered nurses and nurse practitioners are available for drop-in visits. A health card is not required to access the clinics. The charity reports that its nursing and community mental health workers made 12,447 client contacts in F2023.  Street Health spent 9% of program spending on itsoverdose prevention site(OPS) in F2023. Street Health describes the site as a safe place to inject drugs under supervision. The charity supported 1,358 client visits for prescriptions, monitoring, and support in F2023.  The remaining 9% of program spending was allocated toidentification(ID) services in F2023. Street Health helps homeless people get and store IDs. Without ID, seeing a doctor and opening a bank account is difficult. The charity's ID team made 4,705 contacts and processed 3,555 pieces of ID in F2023.",
197,Tearfund Canada,https://www.charityintelligence.ca/media/charity_logos/TFC%202018%20logo.jpg,5,2,A,73%,Markham,ON,www.tearfund.ca,905-415-8181,International Aid,"Poverty Alleviation, Healthcare and Medical Services, Clean Water and Sanitation, Hunger and Food Security","Tearfund Canada is a top-rated five-star charity with a high results reporting grade and overhead spending within Ci's reasonable range. The charity is financially transparent and has funding reserves that can cover less than a year of program costs. Tearfund Canada has good demonstrated impact. Founded in 1982, Tearfund Canada (TFC) is a Christian charity that works to end poverty across the globe. Tearfund Canada uses a model of church-based community transformation where it delivers aid and training to people through partnerships with local churches. Tearfund Canada works collaboratively with nine other independent Tearfund offices in different countries. Tearfund Canada is a member of Canadian Foodgrains Bank (CFGB) which is a partnership of 15 Canadian churches working together to end global hunger. Each member of CFGB has an account with the charity that holds funding for collaborative relief programs. Tearfund Canada’s charitable programs are Relief and Rehabilitation, Development, and Education. In F2021, the charity spent $5.7m on its programs In F2021, TFC spent 63% of program spending on Relief and Rehabilitation. This program involves delivering emergency aid to people in disaster zones and working with local churches to stop gender-based violence. Emergency aid includes food, water, shelter, sanitation, and medical care. In F2021, the charity reports that 292,207 people benefitted from emergency aid and 314,740 women and girls were empowered. Emergency aid was distributed in seven different countries. Tearfund Canada spent 36% of its program spending on Development in F2021. The Development program includes agricultural training and Village Savings Groups. Village Savings Groups are groups of 25 to 30 people who create a pooled savings account that can be used to start a business, send children to school, and meet basic needs without relying on exploitative loan sharks. Groups meet weekly and receive training on bookkeeping and business principles. In F2021, 1,202 new savings groups were organized and 63,678 people were in savings groups. During the year, 49,496 people benefitted from agricultural training and 7,000 acres of new land were farmed. Less than 1% of program spending was allocated to Education.","In F2021, Tearfund Canada distributed 1,644 metric tons of food to families in disaster situations. It reports that 22% of savings group funds were used to start a new business, 14% were used to pay school fees for children, and 13% were used to buy farming supplies. The charity reports that 13,900 farmers were able to increase their yields by two to three times after being trained in new farming techniques."
198,TELUS Spark,https://www.charityintelligence.ca/media/charity_logos/telussparklogo.png,4,2,B,84%,Calgary,AB,www.sparkscience.ca,403-817-6800,Education,STEM Education,"Calgary Science Centre Society (TELUS Spark) is a 4-star charity. It has below-average results reporting and overhead spending within Ci's reasonable range. It is financially transparent. Founded in 1997, Calgary Science Centre Society (operating as TELUS Spark) is Calgary’s only science centre. It gathers people of all ages to learn about science, engineering, technology, math, and arts. While the science centre was closed for most of 2020 and 2021 due to covid-19, TELUS Spark reports that before the pandemic, it served 375,000 guests and 72,000 students annually. In F2021, TELUS Spark spent $6.0m on capital renovations to improve the science centre and its dome theatre, Infinity Dome. In addition to upgrades to the Infinity Dome, TELUS Spark opened a new café and ice cream shop, a digital immersion gallery, and new classrooms for summer camps and school workshops. The charity states that the improvements to the science centre will play an active role in the economic recovery of the tourism sector following the covid-19 pandemic. TELUS Spark operates an access program, which pays for students, families, and individuals who need financial assistance to enter the science centre. In F2021, TELUS Spark increased its access program partners from 58 to 66. The charity reports that its access program provides general admission to more than 16,000 Calgarians annually.",Calgary Science Centre Society reports that its community access program enables thousands of children and families to visit the science centre who otherwise could not afford to.
199,The Compass,https://www.charityintelligence.ca/media/charity_logos/Compass%20logo%202022.png,5,2,B+,95%,Mississauga,ON,www.thecompass.ca,905-274-9309,Social Services,Food banks and hunger relief,"The Compass is a 5-star, Top 10 Canadian Impact Charity. The charity is financially transparent and has High demonstrated impact. It has an above average results reporting grade and its overhead spending is just outside Ci’s reasonable range. The Compass has $1.5m in reserve funds, which can cover annual program costs for 1.1 years. Founded in 2002, The Compass is a Christian food bank and outreach center serving the Mississauga region. Its formal name is Lakeshore Community Outreach Centre. The Compass aims to serve south Mississauga by meeting needs for nutritious food, improving life skills, and fostering a caring community. A Charity Intelligence 2022 Top 10 Canadian Food Bank The Compass’ food bank consists of 14 member churches and 2 supporting churches in Mississauga. Churches and community groups hold food drives and meal events. They also provide financial support and volunteers to the charity. The charity’s programs include its food bank and faith-centred client programs. Food and supply distribution  The food bank, which operates as a market, provides emergency food supplies and weekly food provisions to clients. In 2022, The Compass reports 27,469 visits to the market. The charity served 1,794 households, increasing 74% from the 1,033 households served in F2021. 1,005 of these households were new to the food bank, which is a 178% increase from last year’s 362 new households. This amounted to 4,033 individuals helped by the food bank in F2022, a 65% increase from the 2,451 helped in F2021. The charity states that it distributed 705,278 lb of food in F2022 and provided 38,984 meals. It estimates serving 1,000 to 1,200 meals a week by mid-year. The charity reports benefiting from 38,054 volunteer hours during the year. Client programs  The charity provides client programs such as chaplain services, community lunches and assistance for specific needs. In F2022, The Compass reports preparing 201 tax returns for low-income earners, to help them receive tax benefits. It also provided 37 reconditioned laptops to its clients. At Christmas, it distributed $115,305 in Walmart gift cards to 754 households, through its Spread the Joy program. This is an average of $153 in Walmart gift cards per household. Additionally, The Compass provided 310 children with backpacks and school supplies and sent 53 children to camp during the summer. The charity also gave winter essentials to 40 homeless clients.","The Compass distributed 705,278 lb of food in F2022 to 4,033 individuals. This is an average of 175 lb of food per individual. This included 59,127 pounds of protein, 54,912 litres of milk, 26,800 pounds of fruit and vegetables, and 15,145 dozen eggs."
200,The Mustard Seed,https://www.charityintelligence.ca/media/charity_logos/Mustard%20Logo.png,4,2,B-,87%,Calgary,AB,www.theseed.ca,403-269-1319,Social Services,Homelessness and housing assistance,"Mustard Seed is a 4-star charity. It has low overhead spending and is financially transparent. However, it has a below average results reporting score.   Founded in 1984, Mustard Seed is a Christian charity that helps people overcome homelessness and poverty. Mustard Seed is based in Calgary, Alberta and also operates in four nearby cities. Currently, about 199,000 families live in poverty in Alberta. Mustard Seed provides immediate and long-term support to these people in need.   Mustard Seed runs three main programs: Basic Services, Support Services, and Housing.   In F2022, the Basic Services program represented 57% of program spending. Mustard Seed runs a night shelter in Calgary with space for 370 adults. It also provides food and clothing to people in need. In F2022, Mustard Seed served over 550,500 meals and delivered an additional 50,300 lunches to students in Red Deer.   The Support Services program made up 23% of program spending in F2022. Mustard Seed provides health, employment, advocacy, and religious services. In F2022, the charity held over 60,000 health and wellness appointments. It conducted over 2,000 spiritual conversations with clients. Mustard Seed operates a mobile addictions unit called SeedReach, which helped over 600 people in F2022.    In F2022, the Housing program represented 20% of program costs. Currently, Mustard Seed has 395 affordable housing units and 274 supportive living housing units.","In F2022, Mustard Seed helped 454 people move out of homelessness and into housing. Its support services also helped over 400 clients get jobs."
201,The Redwood,https://www.charityintelligence.ca/media/charity_logos/Redwood%20logo.png,4,2,B+,83%,Toronto,ON,www.theredwood.com,416-533-9372,Social Services,Domestic violence,"The Redwood is a 4-star charity with Average demonstrated impact. It is financially transparent and has an above-average results reporting grade.  Founded in 1993, Redwood provides emergency shelter and services for women and children escaping abuse in the Greater Toronto Area. The charity reports that one in five Canadian women experience emotional or economic abuse in intimate relationships. Through on-site counseling and services, Redwood helps clients live independently and work to break the cycle of abuse. Redwood’s main priority is providing a safe place for women and children escaping abuse. Residents at Redwood’s emergency shelter receive three meals a day, hygiene items, bedding, and childcare supplies. Peer support groups, art and play therapy, wellness resources, and parenting classes help women and children work through trauma. In F2022, the Redwood Bike Club taught 27 children to bike. Women are connected to other community support, including housing services, subsidized daycare and school registration referrals, job training, and legal support. In the Women on the Move program, Redwood organized a virtual career fair that connected 70 participants to future employers. Redwood’s 24-hour crisis line provides women in desperate need with counseling. In F2020, the charity introduced an online platform called iDetermine.ca. The platform allows women to live chat or text to get in touch with a Redwood counselor discreetly. In F2022, iDetermine.ca provided counseling and safety planning for 652 callers, increasing 21% from 540 in the previous year.","In F2022, Redwood housed 178 women and children escaping abuse. These clients left a dangerous situation and received support and 24-hour protection at Redwood."
202,The Stop Community Food Centre,https://www.charityintelligence.ca/media/charity_logos/the%20stop%20community%20food%20centre%20Col%2072.jpg,4,2,B+,67%,Toronto,ON,www.thestop.org,416-652-7867,Social Services,Food banks and hunger relief,"The Stop Community Food Centre is a 4-star charity. It has an above average results reporting grade and its overhead costs are within Ci's reasonable range for overhead spending. The charity has $3.1m in funding reserves which can cover its annual program costs for slightly over one year.  Founded in 1982, The Stop Community Food Centre (The Stop) increases access to healthy food for those living in poverty in Toronto. The charity values dignity, equality, and a sense of community. The Stop claims that one in four people in Toronto struggle to make ends meet. This is due to high housing prices and cost of living. The charity states that Canadians living in poverty are more likely to have health complications and have shorter life expectancies. The Stop has three programs: Emergency Food Access, Community Building and Urban Agriculture. Emergency Food Access In F2022, The Stop Community Food Centre operated a Food Bank twice a week. It provides food hampers to families. The Stop distributed 10,383 hampers and served 23,668 people, 17% more than in F2021. The charity provides a Drop In Meals service. From January to September 2022, it served 58,476 meals. The Good Food Market and Cafe offers food items at affordable prices. Community Building The Stop Community Food Centre operates a Community Advocacy Program. In F2022, it ran three advocacy related events. It also trained ten advocates and two mentors in peer support. Its free income tax clinic served 207 members. The Healthy Beginnings program aims to support low-income expecting parents. It distributed 2,604 grocery gift cards to participants in F2022, amounting to $26,040. The charity also served 4,369 meals in its community kitchens. Urban Agriculture In F2022, The Stop Community Food Centre partnered with Na Me Res (Native Men’s Residence) to host events in the Mashkikii;aki’ing garden at Hillcrest Park. It also maintained the Earlscourt Gardens, where volunteers have grown 237kg of food as of October 2022. This food goes to The Stop’s kitchens and to volunteers. The charity reports that 44 people registered for its Global Roots program. This program focuses on building intercultural relations amongst its participants. The Stop hosts a weekly Farmers’ Market. About 3,000 customers attend the Market weekly. The Stop Community Food Centre does not provide a breakdown of its program spending, nor does it disclose its total program spending.",The Stop Community Food Centre claims that 87% of its volunteers feel more connected to their community and 99% feel their work has made a difference.
203,Toronto Foundation for Student Success,https://www.charityintelligence.ca/media/charity_logos/TFSS%202018%20Logo.png,5,2,A-,95%,Toronto,ON,www.tfss.ca,416-394-6880,Social Services,Youth programs,"Toronto Foundation for Student Success is a 5-star, 2022 Top 100 charity. The charity is financially transparent and has Good demonstrated impact. It has an above average results reporting grade and its overhead spending is within Ci’s reasonable range. Toronto Foundation for Student Success has $13.8m in reserve funds, which can cover half a year of program costs.  Founded in 1998, Toronto Foundation for Student Success (TFSS) supports Toronto District School Board students. Its programs provide food and after-school care to elementary and secondary school students who are experiencing poverty. It strives to remove barriers so that all children have the same learning opportunities. According to TFSS, one in four children in Toronto live in poverty and 40% of children come to school hungry. These children struggle to focus, which affects their learning. The charity states that 95% of children do not have access to after-school programs. It adds that children are at their most vulnerable outside of school. TFSS runs many of its programs in Neighbourhood Improvement Areas (as identified by the City of Toronto) to reach those who are most in need. The charity runs two main programs: Student Nutrition Programs (SNPs) and Beyond 3:30. Toronto Foundation for Student Success is one of the Charity Intelligence 2022 Top 10 Canadian Youth Impact Charities. Student Nutrition Programs – 94% of program spending Toronto Foundation for Student Success works with the Ministry of Children, Community and Social Services to run meal programs. TFSS supports 831 Student Nutrition Programs across Toronto. In F2022, the charity served an average of 218,000 meals daily, totalling 41,534,840 meals that year. This is almost double the number of meals served in F2021 (21,775,916 meals). In F2021, Toronto Foundation for Student Success introduced a Nutrition Pantry Program. The program stocks pantries in secondary schools with shelf-stable foods like tuna, soup, canned fruit, and cereal. Children can take home a week’s worth of lunches from this stock. In F2022, the Nutrition Pantry Program supplied 723,154 meals, a 68% increase from last year’s 431,720 meals. It supported over 39,000 students in F2022. Beyond 3:30 – 6% of program spending Beyond 3:30 is Toronto Foundation for Student Success’ after-school program for at-risk youth. As of F2022, 23 Beyond 3:30 programs are being run at 18 school sites, for more than 1,200 students. The program is for middle school students (aged 11 to 14 years) and runs from 3:30 PM to 6:30 PM each day. Students receive food, homework help, cooking lessons and one-hour fitness sessions. There is also a financial literacy program and a rotating schedule of arts programs. Before covid-19, the charity ran its Gift of Sight and Sound program. In F2022, this program stopped for safety measures. However, the charity continued to send free glasses to students that needed them. Toronto Foundation for Student Success operates an Emergency Fund. This fund provides resources for students that urgently need it, such as food or warm clothing.","In 2012, the Toronto District School Board published a report evaluating the Student Nutrition Program. The report found that middle school students who ate breakfast most days worked better independently. They were also better problem solvers and participated more in class. They performed better in reading, science, and math. About 75% of students said the school meals improved their wellbeing."
204,Toronto Humane Society,https://www.charityintelligence.ca/media/charity_logos/ths_logo_home.jpg,5,2,A,80%,Toronto,ON,www.torontohumanesociety.com,416-392-2273,Animal Welfare,Medical treatments,"Toronto Humane Society is a top-rated 5-star charity. It has an average results reporting grade and low funding reserves. The charity is financially transparent and has reasonable overhead costs. Founded in 1886, Toronto Humane Society (THS) works to promote the humane care and protection of all animals and to prevent cruelty and suffering. THS runs two main programs: Animal Care & Shelter Services and a Spay/Neuter Clinic. It also runs Education & Advocacy programs and subsidizes veterinary costs for low-income pet owners. In F2021, Animal Care & Shelter Services made up 83% of Toronto Humane Society’s total program spending. THS helped over 1,500 animals to be adopted into new homes in F2021. In addition, the charity supplied over 42,000 pounds of food through its Pet Food Bank in F2021. In F2021, the Spay/Neuter Clinic made up 11% of Toronto Humane Society’s total program spending. THS reports that it provided over $400,000 worth of subsidized and free veterinary care, including preventative wellness services, dental, and spay/neuter surgeries.  Toronto Humane Society’s Public Education program made up 7% of total program spending in F2021. THS helped publish 4 medical studies that will help to improve the lives of animals.","In F2021, over 1,500 animals were adopted into new homes. In addition, the charity's Animal Transport and Relocation Program cared for over 700 animals who otherwise would have faced uncertain outcomes."
205,Toronto Metropolitan University,https://www.charityintelligence.ca/media/charity_logos/RYU%20logo.png,4,2,A,68%,Toronto,ON,www.torontomu.ca,416-979-5000,Education,Schools and education institutions,"Toronto Metropolitan University is a four-star charity and one of Canada's largest charities. As with most universities, it has a high results reporting grade and is financially transparent. The university's overhead costs are within Ci's reasonable range, but it has high fundraising costs resulting in a four-star rating. Founded in 1948, Toronto Metropolitan University (TMU), formerly named Ryerson University, is a public university in Ontario. Today, over 45,000 students attend TMU. The university has 62 different bachelor’s programs and 55 PhD and master’s programs. It also has 133 partner universities in 37 different countries. TMU’s main charitable programs are academics and research. In F2021, it spent $805.5m on its programs. In fall of 2021, Toronto Metropolitan University had 46,812 students enrolled. This includes 39,871 undergraduate students, 3,006 master’s students, 646 PhD students, and 3,289 students in continuing education courses. Undergraduate students were enrolled across six faculties: Ted Rogers School of Management (11,897), Community Services (7,123), Communication and Design (6,060), Engineering and Architecture (5,685), Arts (5,256), and Science (3,850). The university reports that 3,404 of its undergraduate students are from outside of Canada, and 1,216 students are from a province other than Ontario. TMU reports that it has 900 affiliated and adjunct graduate faculty members, and 20 Canada Research Chairs. In F2021 its research program had 1,675 academic publications and supported five patent applications.","Toronto Metropolitan University reports that the graduation rate for its fall 2013 entering class was 75.3%. It also reports that 91.2% of its 2018 graduating class had found a job within two years of graduation. In F2021, other researchers cited TMU researchers 33,707 times. The charity reports that its research department created 277 full-time jobs during the year."
